{"$schema":"https://json-schema.org/draft/2020-12/schema","$id":"https://ai-vlog.local/contracts/render/render-execution-plan.v1.json","title":"RenderExecutionPlanV1","type":"object","additionalProperties":false,"required":["schema_version","plan_id","target","semantic_graph_payload","semantic_graph_hash","adapter_id","adapter_version","capability_snapshot","decisions","cache_key_payload","cache_key","diagnostics"],"properties":{"schema_version":{"const":2},"plan_id":{"type":"string","pattern":"^plan-(preview|master)-[0-9a-f]{24}$"},"target":{"enum":["preview","master"]},"semantic_graph_payload":{"type":"string","minLength":2},"semantic_graph_hash":{"type":"string","pattern":"^[0-9a-f]{64}$"},"adapter_id":{"const":"worker-media"},"adapter_version":{"enum":["v2","v3"]},"capability_snapshot":{"$ref":"https://ai-vlog.local/contracts/render/capability-snapshot.v1.json"},"decisions":{"type":"array","items":{"$ref":"https://ai-vlog.local/contracts/render/resolver-decision.v1.json"}},"cache_key_payload":{"type":"string","minLength":2},"cache_key":{"type":"string","pattern":"^[0-9a-f]{64}$"},"diagnostics":{"type":"array","items":{"$ref":"https://ai-vlog.local/contracts/render/render-diagnostic.v1.json"}}}}

