{"schema_version":2,"plan_id":"plan-master-aaaaaaaaaaaaaaaaaaaaaaaa","target":"master","semantic_graph_payload":"{}","semantic_graph_hash":"aaaaaaaaaaaaaaaaaaaaaaaaaaaaaaaaaaaaaaaaaaaaaaaaaaaaaaaaaaaaaaaa","adapter_id":"worker-media","adapter_version":"v2","capability_snapshot":{"schema_version":1,"adapter_id":"worker-media","adapter_version":"v2","capabilities":["source.original"]},"decisions":[{"schema_version":1,"node_id":"source","capability":"source.original","outcome":"execute"}],"cache_key_payload":"{}","cache_key":"bbbbbbbbbbbbbbbbbbbbbbbbbbbbbbbbbbbbbbbbbbbbbbbbbbbbbbbbbbbbbbbb","diagnostics":[]}

